{
  "$schema": "../../schemas/json/platform.schema.json",
  "id": "pc",
  "nameAr": "كمبيوتر / Steam",
  "nameEn": "PC / Steam",
  "toolNameEn": "Steam Families",
  "officialGuideUrl": "https://store.steampowered.com/families",
  "officialGuideTitle": "Steam Families",
  "verifiedAt": null,
  "linkCheckedAt": null,
  "steps": [
    {
      "id": "pc-strangerchat-1",
      "pointKey": "strangerChat",
      "stepAr": "Steam Families ← حساب الطفل ← Community: اقفل Chat و Community content.",
      "sourceUrl": "https://example.org/demo/platforms/pc/strangerChat",
      "verifiedAt": null,
      "isDemo": true
    },
    {
      "id": "pc-purchases-2",
      "pointKey": "purchases",
      "stepAr": "Steam Families: كل شراء من حساب الطفل يوصل طلب موافقة لولي الأمر.",
      "sourceUrl": "https://example.org/demo/platforms/pc/purchases",
      "verifiedAt": null,
      "isDemo": true
    },
    {
      "id": "pc-content-3",
      "pointKey": "content",
      "stepAr": "Steam Families ← Library: اختر الألعاب المسموحة من مكتبة العائلة.",
      "sourceUrl": "https://example.org/demo/platforms/pc/content",
      "verifiedAt": null,
      "isDemo": true
    },
    {
      "id": "pc-sessionpause-4",
      "pointKey": "sessionPause",
      "stepAr": "Steam Families ← Playtime: حدد ساعات اللعب اليومية والأوقات المسموحة.",
      "sourceUrl": "https://example.org/demo/platforms/pc/sessionPause",
      "verifiedAt": null,
      "isDemo": true
    }
  ]
}
