{
  "$schema": "../../schemas/json/platform.schema.json",
  "id": "ios",
  "nameAr": "آيفون وآيباد",
  "nameEn": "iPhone / iPad",
  "toolNameEn": "Screen Time",
  "officialGuideUrl": "https://support.apple.com/ar-sa/105121",
  "officialGuideTitle": "مدة استخدام الجهاز في iPhone/iPad (Apple، عربي)",
  "verifiedAt": null,
  "linkCheckedAt": "2026-10-10",
  "steps": [
    {
      "id": "ios-strangerchat-1",
      "pointKey": "strangerChat",
      "stepAr": "الإعدادات ← Screen Time ← Content & Privacy Restrictions ← Game Center: اقفل «Multiplayer Games» أو خلّها مع الأصدقاء فقط.",
      "sourceUrl": "https://example.org/demo/platforms/ios/strangerChat",
      "verifiedAt": null,
      "isDemo": true
    },
    {
      "id": "ios-purchases-2",
      "pointKey": "purchases",
      "stepAr": "Screen Time ← Content & Privacy Restrictions ← iTunes & App Store Purchases ← In-app Purchases: اختر «Don't Allow»، وفعّل «Ask to Buy» من Family Sharing.",
      "sourceUrl": "https://example.org/demo/platforms/ios/purchases",
      "verifiedAt": null,
      "isDemo": true
    },
    {
      "id": "ios-content-3",
      "pointKey": "content",
      "stepAr": "Content & Privacy Restrictions ← Content Restrictions ← Apps: اختر الحد العمري اللي يناسب طفلك.",
      "sourceUrl": "https://example.org/demo/platforms/ios/content",
      "verifiedAt": null,
      "isDemo": true
    },
    {
      "id": "ios-ads-4",
      "pointKey": "ads",
      "stepAr": "Settings ← Privacy ← Apple Advertising: أوقف «Personalized Ads»، وخلّ «Allow Apps to Request to Track» مقفل.",
      "sourceUrl": "https://example.org/demo/platforms/ios/ads",
      "verifiedAt": null,
      "isDemo": true
    },
    {
      "id": "ios-sessionpause-5",
      "pointKey": "sessionPause",
      "stepAr": "Screen Time ← App Limits: حط حد يومي للعبة، وفعّل «Downtime» لأوقات النوم والدراسة.",
      "sourceUrl": "https://example.org/demo/platforms/ios/sessionPause",
      "verifiedAt": null,
      "isDemo": true
    },
    {
      "id": "ios-searchandstore-6",
      "pointKey": "searchAndStore",
      "stepAr": "Content Restrictions ← Web Content: اختر «Limit Adult Websites»، واضبط الحد العمري في App Store.",
      "sourceUrl": "https://example.org/demo/platforms/ios/searchAndStore",
      "verifiedAt": null,
      "isDemo": true
    }
  ]
}
